{
  "slug": "fall-protection",
  "term": "Fall Protection",
  "definition": "Oregon construction requirements designed to prevent fall injuries, including Oregon-specific duty provisions and employee training obligations for workers exposed to fall hazards.",
  "sourceRefs": [
    "oar-437-003-subdivision-m-fall-protection"
  ],
  "relatedTerms": [
    "personal-protective-equipment",
    "ladder-safety"
  ],
  "topicSlugs": [
    "jobsite-safety"
  ]
}
