{
  "slug": "lead-safe-work-practices",
  "term": "Lead-Safe Work Practices",
  "definition": "Required methods in Oregon lead-renovation programs that reduce lead exposure risk during covered work in older housing and child-occupied settings.",
  "sourceRefs": [
    "oha-lead-contractors-and-painters"
  ],
  "relatedTerms": [
    "lead-based-paint-renovation"
  ],
  "topicSlugs": [
    "environmental-factors"
  ]
}
