{
  "slug": "consideration",
  "term": "Consideration",
  "definition": "Something of legal value exchanged by each party to a contract — typically a promise to perform work or a promise to pay. A promise to do something already legally required does not constitute valid consideration.",
  "sourceRefs": [
    "psi-cib-oregon-construction-contractors"
  ],
  "relatedTerms": [
    "offer",
    "acceptance"
  ],
  "topicSlugs": [
    "contracts"
  ]
}
